{
  "record_type": "model_attempt",
  "record_id": "attempt-fixture",
  "revision": 2,
  "measurement_schema_version": 1,
  "producer": {
    "name": "agent-validator",
    "version": "fixture-only"
  },
  "original_consumer_context": {
    "consumer": "runner",
    "context_id": "fixture-context"
  },
  "payload": {
    "adapter": "fixture",
    "requested_identity": {
      "adapter": "fixture",
      "model": "configured-model",
      "provider": null,
      "effort": null,
      "provenance": "configuration"
    },
    "resolved_identity": {
      "adapter": "fixture",
      "model": "configured-model",
      "provider": null,
      "effort": null,
      "provenance": "launch_resolution"
    },
    "observed_identities": [
      {
        "identity_id": "identity-A",
        "model": "A",
        "provider": {
          "availability": "available",
          "value": "fixture-provider",
          "reason": null
        },
        "effort": {
          "availability": "unavailable",
          "value": null,
          "reason": "not_reported"
        },
        "provenance": "telemetry"
      },
      {
        "identity_id": "identity-B",
        "model": "B",
        "provider": {
          "availability": "available",
          "value": "fixture-provider",
          "reason": null
        },
        "effort": {
          "availability": "unavailable",
          "value": null,
          "reason": "not_reported"
        },
        "provenance": "telemetry"
      }
    ],
    "observed_identity_availability": {
      "availability": "available",
      "reason": null
    },
    "tokens": {
      "input_total": {
        "availability": "available",
        "value": 100,
        "reason": null,
        "source": "provider_usage",
        "origin": "observed",
        "precision": "exact",
        "derivation": null,
        "included_in": null
      },
      "input_uncached": {
        "availability": "unavailable",
        "value": null,
        "reason": "adapter_usage_unsupported",
        "source": null,
        "origin": null,
        "precision": null,
        "derivation": null,
        "included_in": null
      },
      "cache_read": {
        "availability": "unavailable",
        "value": null,
        "reason": "adapter_usage_unsupported",
        "source": null,
        "origin": null,
        "precision": null,
        "derivation": null,
        "included_in": null
      },
      "cache_write": {
        "availability": "unavailable",
        "value": null,
        "reason": "adapter_usage_unsupported",
        "source": null,
        "origin": null,
        "precision": null,
        "derivation": null,
        "included_in": null
      },
      "output": {
        "availability": "partial",
        "value": 50,
        "reason": "truncated_source",
        "source": "provider_usage",
        "origin": "observed",
        "precision": "exact",
        "derivation": null,
        "included_in": null
      },
      "reasoning": {
        "availability": "unavailable",
        "value": null,
        "reason": "adapter_usage_unsupported",
        "source": null,
        "origin": null,
        "precision": null,
        "derivation": null,
        "included_in": null
      },
      "provider_total": {
        "availability": "unavailable",
        "value": null,
        "reason": "adapter_usage_unsupported",
        "source": null,
        "origin": null,
        "precision": null,
        "derivation": null,
        "included_in": null
      },
      "normalized_total": {
        "availability": "partial",
        "value": 150,
        "reason": "truncated_source",
        "source": "provider_usage",
        "origin": "observed",
        "precision": "exact",
        "derivation": null,
        "included_in": null
      }
    },
    "provider_native_usage": [],
    "completeness": {
      "collection": "complete",
      "canonical_fields": "partial",
      "normalized_total": "partial",
      "per_model_attribution": "unavailable",
      "history": "complete"
    },
    "allocations": [],
    "unallocated_usage": null,
    "provider_reported_costs": [],
    "provenance": {
      "adapter_mapping_version": "adapter-collection-v1",
      "cli_version": {
        "availability": "unavailable",
        "value": null,
        "reason": "not_collected"
      },
      "source_format_version": {
        "availability": "unavailable",
        "value": null,
        "reason": "not_exposed"
      },
      "producer_version": "fixture-only",
      "build": {
        "availability": "unavailable",
        "value": null,
        "reason": "synthetic_fixture"
      }
    },
    "diagnostics": [
      "synthetic_contract_fixture"
    ],
    "record_type": "model_attempt",
    "attempt_id": "attempt-fixture",
    "invocation_id": "invocation-fixture",
    "session_id": "session-fixture",
    "revision": 2,
    "measurement_schema_version": 1,
    "lifecycle": {
      "state": "completed",
      "started_at": "2026-09-06T12:00:00.000Z",
      "ended_at": "2026-09-06T12:00:01.000Z"
    },
    "outcome": "passed"
  },
  "digest": {
    "algorithm": "sha256",
    "canonicalization": "rfc8785",
    "value": "61fd88dca94e46129f2fe5468407ae1339b77a1184e8b8397134cae3e0d95c04"
  }
}
