{"digest":{"algorithm":"sha256","canonicalization":"rfc8785","value":"61fd88dca94e46129f2fe5468407ae1339b77a1184e8b8397134cae3e0d95c04"},"measurement_schema_version":1,"original_consumer_context":{"consumer":"runner","context_id":"fixture-context"},"payload":{"adapter":"fixture","allocations":[],"attempt_id":"attempt-fixture","completeness":{"canonical_fields":"partial","collection":"complete","history":"complete","normalized_total":"partial","per_model_attribution":"unavailable"},"diagnostics":["synthetic_contract_fixture"],"invocation_id":"invocation-fixture","lifecycle":{"ended_at":"2026-09-06T12:00:01.000Z","started_at":"2026-09-06T12:00:00.000Z","state":"completed"},"measurement_schema_version":1,"observed_identities":[{"effort":{"availability":"unavailable","reason":"not_reported","value":null},"identity_id":"identity-A","model":"A","provenance":"telemetry","provider":{"availability":"available","reason":null,"value":"fixture-provider"}},{"effort":{"availability":"unavailable","reason":"not_reported","value":null},"identity_id":"identity-B","model":"B","provenance":"telemetry","provider":{"availability":"available","reason":null,"value":"fixture-provider"}}],"observed_identity_availability":{"availability":"available","reason":null},"outcome":"passed","provenance":{"adapter_mapping_version":"adapter-collection-v1","build":{"availability":"unavailable","reason":"synthetic_fixture","value":null},"cli_version":{"availability":"unavailable","reason":"not_collected","value":null},"producer_version":"fixture-only","source_format_version":{"availability":"unavailable","reason":"not_exposed","value":null}},"provider_native_usage":[],"provider_reported_costs":[],"record_type":"model_attempt","requested_identity":{"adapter":"fixture","effort":null,"model":"configured-model","provenance":"configuration","provider":null},"resolved_identity":{"adapter":"fixture","effort":null,"model":"configured-model","provenance":"launch_resolution","provider":null},"revision":2,"session_id":"session-fixture","tokens":{"cache_read":{"availability":"unavailable","derivation":null,"included_in":null,"origin":null,"precision":null,"reason":"adapter_usage_unsupported","source":null,"value":null},"cache_write":{"availability":"unavailable","derivation":null,"included_in":null,"origin":null,"precision":null,"reason":"adapter_usage_unsupported","source":null,"value":null},"input_total":{"availability":"available","derivation":null,"included_in":null,"origin":"observed","precision":"exact","reason":null,"source":"provider_usage","value":100},"input_uncached":{"availability":"unavailable","derivation":null,"included_in":null,"origin":null,"precision":null,"reason":"adapter_usage_unsupported","source":null,"value":null},"normalized_total":{"availability":"partial","derivation":null,"included_in":null,"origin":"observed","precision":"exact","reason":"truncated_source","source":"provider_usage","value":150},"output":{"availability":"partial","derivation":null,"included_in":null,"origin":"observed","precision":"exact","reason":"truncated_source","source":"provider_usage","value":50},"provider_total":{"availability":"unavailable","derivation":null,"included_in":null,"origin":null,"precision":null,"reason":"adapter_usage_unsupported","source":null,"value":null},"reasoning":{"availability":"unavailable","derivation":null,"included_in":null,"origin":null,"precision":null,"reason":"adapter_usage_unsupported","source":null,"value":null}},"unallocated_usage":null},"producer":{"name":"agent-validator","version":"fixture-only"},"record_id":"attempt-fixture","record_type":"model_attempt","revision":2}
